{
  "_id": {
    "$oid": "68d5e6605e415868610dd2da"
  },
  "game_session_id": {
    "$oid": "68d5e6605e415868610dd2d9"
  },
  "messages": [
    {
      "sender": "StoryOS",
      "content": "The crisp autumn air of Hamilton, Ontario, fil...ing leaves outside. What do you do?",
      "full_prompt": [
        {
          "role": "system",
          "content": "You are StoryOS, an expert storyteller and dungeon master. Create engaging, immersive openings for text-based RPGs."
        },
        {
          "role": "user",
          "content": "\nBased on the following scenario, generate an enga...t their first action.\n"
        }
      ],
      "timestamp": "2025-09-26T01:04:05.028135",
      "message_id": "68d5e6605e415868610dd2d9_0"
    },
    {
      "sender": "player",
      "content": "brush my teeth and head down to commons building to grab breakfast, look around once i get to the quad between the buildings to see if any of my friends are walking around",
      "full_prompt": [
        {
          "role": "system",
          "content": "=== GENERAL GAME RULES ===\n# Rol...ers bedroom.\n"
        },
        {
          "role": "assistant",
          "content": "The crisp autumn air of Hamilton, Ontario, fil...ing leaves outside. What do you do?"
        },
        {
          "role": "user",
          "content": "brush my teeth and head down to commons building to grab breakfast, look around once i get to the quad between the buildings to see if any of my friends are walking around"
        }
      ],
      "timestamp": "2025-09-26T01:08:32.875886",
      "message_id": "68d5e6605e415868610dd2d9_1"
    },
    {
      "sender": "StoryOS",
      "content": "You splash water on your face after bru...n\nWhat do you do?",
      "full_prompt": [
        {
          "role": "system",
          "content": "=== GENERAL GAME RULES ===\n# Rol...ers bedroom.\n"
        },
        {
          "role": "assistant",
          "content": "The crisp autumn air of Hamilton, Ontario, fil...ing leaves outside. What do you do?"
        },
        {
          "role": "user",
          "content": "brush my teeth and head down to commons building to grab breakfast, look around once i get to the quad between the buildings to see if any of my friends are walking around"
        }
      ],
      "timestamp": "2025-09-26T01:08:39.132489",
      "message_id": "68d5e6605e415868610dd2d9_2",
      "visual_prompts": [
        "Hyper-realistic candid photo in landscape orientation, captured on a high-end smartp...amera.",
        "Hyper-realistic candid photo in landscape orientation, taken on a high-end smartphon...the camera.",
        "Hyper-realistic candid photo in landscape orientation, smartphone-style with hig...he camera."
      ]
    }
  ],
  "created_at": "2025-09-26T01:03:28.789176"
}